{
	"$schema": "http://json-schema.org/draft-07/schema#",
	"title": "TextpackForgeSnapshot",
	"type": "object",
	"additionalProperties": false,
	"required": [
		"schemaVersion",
		"snapshotId",
		"sourceId",
		"version",
		"retrievedAt",
		"kind",
		"checksum"
	],
	"properties": {
		"schemaVersion": { "const": "1" },
		"snapshotId": { "type": "string", "minLength": 1 },
		"sourceId": { "type": "string", "minLength": 1 },
		"version": { "type": "string", "minLength": 1 },
		"retrievedAt": { "type": "string", "minLength": 1 },
		"kind": {
			"enum": ["repository", "archive", "directory", "external", "file-set"]
		},
		"checksum": { "type": "string", "minLength": 1 },
		"files": {
			"type": "array",
			"minItems": 1,
			"items": {
				"type": "object",
				"additionalProperties": false,
				"required": ["path", "byteLength", "checksum"],
				"properties": {
					"path": { "type": "string", "minLength": 1 },
					"mediaType": { "type": "string", "minLength": 1 },
					"byteLength": { "type": "integer", "minimum": 0 },
					"checksum": { "type": "string", "minLength": 1 },
					"sourceUrl": { "type": "string", "minLength": 1 }
				}
			}
		},
		"notes": { "type": "string", "minLength": 1 }
	}
}
