{
	"schemaVersion": "1",
	"snapshotId": "snapshot:source:ud:french-gsd:r2.18",
	"sourceId": "source:ud:french-gsd-r2.18",
	"version": "r2.18@15958a5df1d09e2a360784caaed07b9a3fcbf7a8",
	"retrievedAt": "2026-06-12T00:00:00.000Z",
	"kind": "file-set",
	"checksum": "sha256:083b0e45634b74c075f94ef85057210ecd46836167ede71bc131555d1987d6f4",
	"files": [
		{
			"path": "tools/textpack-forge/snapshots/data/ud-french-gsd-r2.18/fr_gsd-ud-dev.conllu",
			"mediaType": "text/plain; charset=utf-8",
			"byteLength": 2573677,
			"checksum": "sha256:9221e5084cc6a1b1540671cfbd2fc0456efc223b2fe8dd2146c2bad921be02d4",
			"sourceUrl": "https://raw.githubusercontent.com/UniversalDependencies/UD_French-GSD/15958a5df1d09e2a360784caaed07b9a3fcbf7a8/fr_gsd-ud-dev.conllu"
		},
		{
			"path": "tools/textpack-forge/snapshots/data/ud-french-gsd-r2.18/fr_gsd-ud-test.conllu",
			"mediaType": "text/plain; charset=utf-8",
			"byteLength": 724095,
			"checksum": "sha256:eee5a599b429658b6ee8582fae9993eb07161247fc64bad57d16b2050ed4eb1a",
			"sourceUrl": "https://raw.githubusercontent.com/UniversalDependencies/UD_French-GSD/15958a5df1d09e2a360784caaed07b9a3fcbf7a8/fr_gsd-ud-test.conllu"
		},
		{
			"path": "tools/textpack-forge/snapshots/data/ud-french-gsd-r2.18/fr_gsd-ud-train.conllu",
			"mediaType": "text/plain; charset=utf-8",
			"byteLength": 25555018,
			"checksum": "sha256:4b9a87b1b7e6e7003219df1d3ccca87ffaca0f00a6055b12b1857df5373589d2",
			"sourceUrl": "https://raw.githubusercontent.com/UniversalDependencies/UD_French-GSD/15958a5df1d09e2a360784caaed07b9a3fcbf7a8/fr_gsd-ud-train.conllu"
		},
		{
			"path": "tools/textpack-forge/snapshots/data/ud-french-gsd-r2.18/LICENSE.txt",
			"mediaType": "text/plain; charset=utf-8",
			"byteLength": 202,
			"checksum": "sha256:899b1804a12ebc090b96339614eede1b64b686721b650a71430b55b5235f7f79",
			"sourceUrl": "https://raw.githubusercontent.com/UniversalDependencies/UD_French-GSD/15958a5df1d09e2a360784caaed07b9a3fcbf7a8/LICENSE.txt"
		},
		{
			"path": "tools/textpack-forge/snapshots/data/ud-french-gsd-r2.18/README.md",
			"mediaType": "text/markdown; charset=utf-8",
			"byteLength": 8040,
			"checksum": "sha256:d1a541bb6790fc3d02ed70a281bd4320593b98b8b06ed71371004c98bd74e37d",
			"sourceUrl": "https://raw.githubusercontent.com/UniversalDependencies/UD_French-GSD/15958a5df1d09e2a360784caaed07b9a3fcbf7a8/README.md"
		}
	],
	"notes": "Pinned UD French GSD r2.18 files. Generated packages must remain share-alike isolated."
}
